{"$schema":"https://json-schema.org/draft/2020-12/schema","$id":"urn:sa2a:key-record:v1","type":"object","required":["key_id","custodian_id","algorithm","public_key","state","not_before_ms","expires_at_ms","revocation_epoch"],"properties":{"key_id":{"type":"string","minLength":1},"custodian_id":{"type":"string","minLength":1},"algorithm":{"enum":["ed25519","ml-dsa-65","slh-dsa-shake-128f"]},"state":{"enum":["active","revoked"]},"public_key":{"type":"array","items":{"type":"integer","minimum":0,"maximum":255}},"not_before_ms":{"type":"integer","minimum":0},"expires_at_ms":{"type":"integer","minimum":1},"revocation_epoch":{"type":"integer","minimum":0}},"additionalProperties":false}