[{"key_id":"mac-1","custodian_id":"device:macbook","algorithm":"ed25519","public_key":[],"state":"active","not_before_ms":0,"expires_at_ms":9999999999999,"revocation_epoch":0},{"key_id":"phone-1","custodian_id":"device:iphone","algorithm":"ed25519","public_key":[],"state":"active","not_before_ms":0,"expires_at_ms":9999999999999,"revocation_epoch":0},{"key_id":"policy-1","custodian_id":"service:authority","algorithm":"ml-dsa-65","public_key":[],"state":"active","not_before_ms":0,"expires_at_ms":9999999999999,"revocation_epoch":0}]